{
  "schemaVersion": 2,
  "id": "run-20260821T221855302Z-caaa7924-dcfd-4a6c-a042-b83c7c075e94",
  "generatedAt": "2026-08-21T22:18:55.302Z",
  "record": {
    "file": "run-20260821T221855302Z-caaa7924-dcfd-4a6c-a042-b83c7c075e94.json",
    "recordedAt": "2026-08-21T22:18:55.376Z"
  },
  "repository": {
    "capture": "pre-and-post-execution",
    "commit": "1379eaae9d2897b453fd1b4070323806fa794e95",
    "dirty": false,
    "changedDuringRun": false,
    "preExecution": {
      "capturedAt": "2026-08-21T22:13:56.228Z",
      "commit": "1379eaae9d2897b453fd1b4070323806fa794e95",
      "dirty": false,
      "statusSha256": "e3b0c44298fc1c149afbf4c8996fb92427ae41e4649b934ca495991b7852b855"
    },
    "postExecution": {
      "capturedAt": "2026-08-21T22:18:55.372Z",
      "commit": "1379eaae9d2897b453fd1b4070323806fa794e95",
      "dirty": false,
      "statusSha256": "e3b0c44298fc1c149afbf4c8996fb92427ae41e4649b934ca495991b7852b855"
    }
  },
  "system": {
    "architecture": "x64",
    "cpu": {
      "count": 4,
      "model": "AMD EPYC 7763 64-Core Processor                "
    },
    "environment": {
      "githubRepository": "RIAEvangelist/node-ipc",
      "imageOS": "win25-vs2026",
      "imageVersion": "20260818.207.1",
      "nodeLane": "24.18.1",
      "npm": "npm/11.16.0",
      "osLane": "windows-latest",
      "provider": "github-actions",
      "runAttempt": "1",
      "runId": "32532034623",
      "runnerArchitecture": "X64",
      "runnerEnvironment": "github-hosted",
      "sourceRef": "refs/heads/main",
      "sourceSha": "1379eaae9d2897b453fd1b4070323806fa794e95",
      "workflow": "Record benchmark snapshots",
      "workflowRef": "RIAEvangelist/node-ipc/.github/workflows/benchmark-snapshot.yml@refs/heads/main",
      "workflowSha": "1379eaae9d2897b453fd1b4070323806fa794e95"
    },
    "machine": {
      "id": "2524b79edef03ad7"
    },
    "node": "v24.18.1",
    "platform": "win32",
    "release": "10.0.26100",
    "totalMemoryBytes": 17174360064
  },
  "oracle": {
    "build": {
      "binarySha256": "36a70b1841a24c52eaa8268c42e3e02216ecb2c1fd2d47157f517235d457bb17",
      "compiler": "clang",
      "flags": [
        "-O3",
        "-std=c11",
        "-lws2_32"
      ],
      "sourceSha256": "729044e837aa22519037e4e7a59ebce3c2cf637893d5bdaf49de36382be8af56",
      "target": {
        "architecture": "x64",
        "name": "raw-echo.exe",
        "platform": "win32"
      },
      "version": "clang version 20.1.8"
    },
    "implementation": "standard-c",
    "source": {
      "sha256": "729044e837aa22519037e4e7a59ebce3c2cf637893d5bdaf49de36382be8af56"
    }
  },
  "evidence": {
    "authority": "snapshot-noisy",
    "classification": "clean-c-oracle-snapshot",
    "comparison": {
      "adapters": [
        "node-net"
      ],
      "state": "baseline-only"
    },
    "packageFootprintStatus": "measured",
    "privacy": {
      "excluded": [
        "absolute-paths",
        "ephemeral-ports",
        "process-ids"
      ],
      "sanitized": true
    },
    "publishable": true,
    "rankingEligible": false,
    "reasons": [
      "no-comparable-node-ipc-adapter"
    ]
  },
  "config": {
    "adapters": [
      "node-net"
    ],
    "host": "127.0.0.1",
    "oracle": "c",
    "passes": [
      "speed",
      "resource",
      "latency"
    ],
    "payloadBytes": 64,
    "quick": false,
    "samplesPerPass": 7,
    "timeoutMs": 600000,
    "warmupFrames": 100000,
    "frames": {
      "latency": 1000000,
      "resource": 1000000,
      "speed": 1000000
    },
    "footprint": true
  },
  "samples": [
    {
      "adapter": "node-net",
      "cleanup": {
        "clean": true,
        "endpointClosed": true,
        "endpointReusable": true,
        "leftovers": {
          "bytes": 0,
          "entries": 0
        },
        "naturalExit": true,
        "oracle": {
          "type": "cleanup",
          "acceptedConnections": 1,
          "activeSocketsAfterClose": 0,
          "bytesIn": 70400000,
          "bytesOut": 70400000,
          "destroyedSockets": 0,
          "cpuSeconds": 0.109375
        },
        "worker": {
          "openSockets": 0,
          "pendingBytes": 0,
          "socketsClosed": 1,
          "socketsCreated": 1,
          "activeResourceDelta": [],
          "clean": true
        }
      },
      "gc": {
        "durationMs": 0,
        "events": 0,
        "exposed": true,
        "forcedRuns": 15,
        "observed": false
      },
      "index": 0,
      "memory": {
        "oracle": {
          "end": null,
          "start": null
        },
        "worker": {
          "afterCleanupGc": {
            "rss": 48472064,
            "heapTotal": 8101888,
            "heapUsed": 5120568,
            "external": 2095328,
            "arrayBuffers": 137659
          },
          "afterImport": {
            "rss": 46149632,
            "heapTotal": 7839744,
            "heapUsed": 4855160,
            "external": 2095312,
            "arrayBuffers": 137643
          },
          "beforeCleanupGc": {
            "rss": 49025024,
            "heapTotal": 8626176,
            "heapUsed": 5514432,
            "external": 2345120,
            "arrayBuffers": 387451
          },
          "beforeImport": {
            "rss": 45879296,
            "heapTotal": 7839744,
            "heapUsed": 4794592,
            "external": 2081987,
            "arrayBuffers": 137643
          },
          "connected": {
            "rss": 46477312,
            "heapTotal": 8101888,
            "heapUsed": 4905192,
            "external": 2095312,
            "arrayBuffers": 137643
          },
          "heapReclaimedBytes": 393864,
          "postRun": {
            "rss": 48955392,
            "heapTotal": 8626176,
            "heapUsed": 5483880,
            "external": 2345120,
            "arrayBuffers": 387451
          },
          "peak": {
            "rss": 49025024,
            "heapTotal": 8626176,
            "heapUsed": 5512568,
            "external": 2345120,
            "arrayBuffers": 387451
          },
          "ready": {
            "rss": 48910336,
            "heapTotal": 8626176,
            "heapUsed": 5109968,
            "external": 2095376,
            "arrayBuffers": 137707
          }
        }
      },
      "metrics": {
        "bytesPerSecond": 160607094.8184136,
        "cpu": {
          "user": 125000,
          "system": 281000
        },
        "elapsedNs": "398488000",
        "eventLoopDelayNs": null,
        "eventLoopUtilization": {
          "idle": 0,
          "active": 398.8178000000189,
          "utilization": 1
        },
        "framesPerSecond": 2509485.8565377123,
        "millisecondsPerMillion": 398.488,
        "resourceUsage": {
          "end": {
            "userCPUTime": 312000,
            "systemCPUTime": 359000,
            "maxRSS": 49476,
            "sharedMemorySize": 0,
            "unsharedDataSize": 0,
            "unsharedStackSize": 0,
            "minorPageFault": 0,
            "majorPageFault": 28888,
            "swappedOut": 0,
            "fsRead": 10,
            "fsWrite": 0,
            "ipcSent": 0,
            "ipcReceived": 0,
            "signalsCount": 0,
            "voluntaryContextSwitches": 0,
            "involuntaryContextSwitches": 0
          },
          "start": {
            "userCPUTime": 187000,
            "systemCPUTime": 78000,
            "maxRSS": 49476,
            "sharedMemorySize": 0,
            "unsharedDataSize": 0,
            "unsharedStackSize": 0,
            "minorPageFault": 0,
            "majorPageFault": 15375,
            "swappedOut": 0,
            "fsRead": 10,
            "fsWrite": 0,
            "ipcSent": 0,
            "ipcReceived": 0,
            "signalsCount": 0,
            "voluntaryContextSwitches": 0,
            "involuntaryContextSwitches": 0
          }
        },
        "oracle": {
          "cpuToWallRatio": 0.1758693008497844,
          "saturated": false,
          "wallNs": "621910700"
        },
        "baselineMillisecondsPerMillion": 398.488,
        "deltaMillisecondsPerMillion": 0
      },
      "exact": {
        "byteCountsVerified": true,
        "configuredFrames": 1000000,
        "receivedBytes": 64000000,
        "receivedFrames": 1000000,
        "sentBytes": 64000000,
        "sentFrames": 1000000,
        "oracleBytes": 70400000,
        "oracleByteCountVerified": true
      },
      "latencyNs": null,
      "package": {
        "name": "node:net",
        "bundled": true,
        "dependencyCount": 0,
        "fileCount": 0,
        "installedBytes": 0
      },
      "pass": "speed",
      "processExit": {
        "oracle": {
          "code": 0,
          "signal": null
        },
        "worker": {
          "code": 0,
          "signal": null
        }
      }
    },
    {
      "adapter": "node-net",
      "cleanup": {
        "clean": true,
        "endpointClosed": true,
        "endpointReusable": true,
        "leftovers": {
          "bytes": 0,
          "entries": 0
        },
        "naturalExit": true,
        "oracle": {
          "type": "cleanup",
          "acceptedConnections": 1,
          "activeSocketsAfterClose": 0,
          "bytesIn": 70400000,
          "bytesOut": 70400000,
          "destroyedSockets": 0,
          "cpuSeconds": 0.234375
        },
        "worker": {
          "openSockets": 0,
          "pendingBytes": 0,
          "socketsClosed": 1,
          "socketsCreated": 1,
          "activeResourceDelta": [],
          "clean": true
        }
      },
      "gc": {
        "durationMs": 0,
        "events": 0,
        "exposed": true,
        "forcedRuns": 15,
        "observed": false
      },
      "index": 1,
      "memory": {
        "oracle": {
          "end": null,
          "start": null
        },
        "worker": {
          "afterCleanupGc": {
            "rss": 48779264,
            "heapTotal": 8626176,
            "heapUsed": 5122152,